,text,label
3057,@RadioFreeTom IMHO those who need to constantly remind ppl they own guns are usually the alcoholics who have accidents or domestic violence charges. It’s Operational Security to keep your own gun ownership a secret. My pops had a rifle and in 40 years I never saw him use it or talk about it.,0
3429,"@RichardWhitloc2 Sorry I wasn’t being clear.

I think intimate partner violence, misogyny, sexism are still unfortunately prevalent even today. By ‘most everyone’ I meant we all have some kind of implicit bias blind spot (gender, race, etc.).

Maybe acknowledging his death wasn’t the best idea 😕",0
4258,"@letterboxdlisa sadly this is not uncommon in domestic violence cases, relationships are so complex. I hope she is in a much better place now 🙏",0
587,@TerrelJohnson10 @5_stelly Exactly!  I have yet to see or hear anyone laying hands on Floyd Mayweather Jr for his alleged domestic violence.,0
1934,@_bi_disaster @IZUMIDORlYA Ty! I was thinking the same 😒 way to continue putting one child on a pedestal &amp; delegating the responsibility. She can’t Keep victimizing herself and being over-dependant. It’s not a child’s responsibility to save their family when the main issue was domestic abuse.,0
299,@HighImpactFlix Hello Brian my name is Brandon I was trying to get ahold of you to do a livestream because I messed up not taking a plea deal on domestic violence I didn't commit I was beat for nearly an hour with a broomstick and was almost shot now I'm looking at prison,0
168,"Somehow I came across a Tweet that said they can’t sympathize with a woman who fired her staff (since her husband can’t help raising their baby) because she’s a landlord. I hope they’re not talking about *that* woman, considering her husband is potentially abusive.",0
1506,"@JusticeAunties The rate of indigenous domestic violence is 37 times higher than in the non indigenous community. Don’t try to whitewash it.

If you truly believe BLM, I would start there.",0
3824,"@ColossalCastro Hahahaha see, I can’t be laughing at domestic violence! Lmao why you do that!?",0
766,Looking for a speaker? Check-out my story and let me know if I meet your needs: buff.ly/2NyA5Ah #DomesticViolence #SexualViolence #EngagingMen #VAW #FamilyViolence,0
778,"@rd1iemzcog54sk7 @JamesBurgon @LucasMitte @LaylaMoran My sisters have slapped me. My partner has slapped me. Of course I take some blame, of course their violence was not threatening to me so was of a different order to actual domestic abuse.

But two things. 1. They were still wrong to do it. 2. Layla is standing to be leader.",1
2311,"I am a writer who needs to make ends meet asap! I had to move out of a domestic violence situation and am offering pay-what-you-want commissions. Will do fanfics, ocs, self-insert and nsfw.  Reply to this message or dm me for more info
#writer #DomesticViolence #emergency",0
63,"I have to do a 5 minute Spanish presentation on how domestic violence is represented in Spanish film, literature, and music. Yeah, I didn’t choose the topic. Please send help cause I can’t find any resources",0
3774,"@glennEmartin Hmmmmm... Caught a ""domestic violence"" rap for whipping my 30+year younger cuzin that put her hand in my face... In spite of the female officer present the Negro male officer took ME downtown. Definitely colorism. Filed a complaint to no avail. 😡",0
3905,"@blacktail701 @Pismo_B @DEPLORABLEREEG1 @OfficerNorman FFS. Did you watch the video? She was already pregnant and fled her home due to domestic violence. She was “homeless” because the shelter she was staying in kicked her out. Not that it’s any of your fucking business, and I’m sure you’ll still find a way to blame the victim:",0
1563,"@WTEDyke @qpheevr I think domestic violence, and even violence against women OUTSIDE the home, is pretty damn universal. Women suffer at the hands of men. Period.

The issue is that JKR chooses to demonize trans women as perpetrators of this violence, despite overwhelming evidence to the contrary.",0
1964,@wealthnextrest @chykepetrus @SympLySimi I wonder what staying humble has to do with domestic violence and possible murder. I really hope you get a taste of it since it’s something you so divinely stand for.,0
2122,"@level14boss @ainsleygreenhal @SoozUK I was a victim of domestic abuse but that doesn't effect my feelings about trans women, they are women and welcome in our spaces, I do however have a problem with toxic masculinity. I don't understand how JKR's abuse makes any difference to her views on trans women?",1
997,"@Miss_AC1 Yeah, I agree, the conversation needs to happen, sadly men still think they are weak if they confess to being a victim of Domestic Abuse - NOTHING could  be further from truth - it takes a LOT of courage to ask  for  help - the fantastic work that @ManKindInit does helps :)",0
3848,if arrested this will b #16 never once read my #Rights defended innocent until proven guilty let alone fucking sexually assaulted left for dead denied all my assets. #MeToo #economicabuse #DomesticViolence  #EndFemicide #Murder,0
4035,"@SONTSeattle @thesportsontap Flash will be cheaper, stick around longer, &amp; has no history of sexual assault. I think this is a no-brainer.

I’m sorry, but drug use is a health care issue. Josh Gordon deserves support &amp; treatment.

Domestic abuse/sexual assault is a criminal/social issue. MUCH bigger problem.",0
2822,One American state* did this - mandatory removal of perps rather than victims - and it was very successful at reducing recidivism so I don't know why it's not more widespread *apologies for vagueness v tired atm. #DomesticViolence #lockdownuk twitter.com/Marian_Duggan/…,0
1238,@ANI I think domestic violence may increase with influence of alcohol,0
537,"Forcing trans people, victims of domestic violence, whistleblowers, etc., etc., to use their 'real' names, howsoever that is defined, opens already-marginalized people to further abuse and victimization.

Besides, my real name is whatever name I use. That's what makes it real. twitter.com/neil_neilzone/…",0
4398,@KevinFexe i’m not sure tbh. i haven’t seen anything new about him but she had been arrested in the past for domestic abuse against him,0
1632,I'm proud to work with @RoseAndomCenter and grateful for all they're doing for our community during the pandemic. Check out their May newsletter to learn more! #domesticviolence #DV twitter.com/RoseAndomCente…,0
4250,"@TyphoidMary7 Totally agree.....
and i was Just giving my own input to the abuse debate.
I know what you have been through in your life..
My partner (ex) sort of....   Daughter is in the pacemaker specialist field and poached all over Australia...
Much Love Darling.. for next year..",0
957,@Baba_KaYoliswa Yazi I've noticed kwezi domestic violence/GBV that there is a rapidly rising trend of men purposely ruining or attempt to ruin their woman/partner/spouse face. I mean they really make strides &amp; effort to basically wipe the beauty off of her literally!! #Jealousy 😑,0
3949,"Most parents think it's most important to check if a man/woman is financially buoyant or not before getting their daughters/sons married to them,but considering the rate of domestic violence I think it's highly essential to check if he/she is mentally stable.",0
3149,@DawgBelly I'm not going to celebrate a wife beater. I acknowledge he has passed. I acknowledge he was considered an acting great. But he was still a domestic violence perpetrator.,0
3125,"@kramski Also in what way was that story related to trans issues? I don't mean to belittle her experience by any means, abuse and domestic violence is to be taken seriously. But the presentation as proof to make a point is far-fetched beyond imagination.",0
1520,We suddenly have action on support for #domesticviolence and support for #Mentalhealth as well as a large increase in the value of welfare payments (although poorly administered). Will there be any going back from this? I hope not. #coronavirusaustralia #UBI #StayHomeSaveLives,0
1252,"cn animal abuse 

my friends partner is a serious animal abuser. how can I tell friend that I don’t want to hear about partner? none of that “we did this” or “we’re going to ...”  I don’t want to know that person exists. she should never have told me about what her partner did.",0
3946,"@ChiefResch “We’re too busy brutalizing people to have a camera and fingerprint system set up at any of our other jails” is all I’m seeing here, Chief. 

Quit using domestic violence as a reason we need to quit protesting your asses.",0
852,@aajtak What about domestic violence? I and my brother fight all day long.😛,0
1393,"@CABallada09 Dahil sa lockdown, mas dumadami ang biktima ng domestic violence. Just a few days ago, I was reading this article about a battered wife na gumagawa parin ng paraan para hindi magalit at mapag-balingan mga anak nila. Sad lang. Tinatanggap niya mga suntok para sa mga anak niya.",0
1829,"@CNN I gotta a new headline!Officer shoots man wielding a knife in a domestic violence call, after asking him multiple times to comply and two taser attempts he continued to his vehicle and STILL DID NOT COMPLY THEN REACHED FOR HIS WEAPON. Police fire in an attempt to save their life!",0
1595,@the21stcaveman @Alex_Kack @Joshua4Congress I forgot social worker and therapist! We are even trained too look for domestic violence and often intervene to help survivors. I got three clients to go to the dr. &amp; got cancer diagnosed super early and wouldn’t have without my training and advice. Thyroid &amp; skin. We save lives.,0
1119,"@Skeesar01 Your partner. Like if I’m going on brunch date or a girls trip and stuff I’m not gonna use our joint account, it’ll be my money. It’s also the safety and security of if anything were to happen I’m not left broke and relying on someone. That’s how cycles of abuse start.",0
3620,"How many times do I need to come on this site and say DESTROYING OR THROWINF AWAY YOUR PARTNER/FRIEND/FAMILY MEMBERS PROPERTY IS ABUSE. I don't care if it's a drawing, a blanket, a sports car. It's abuse. Period. twitter.com/AITA_reddit/st…",0
3764,"Lmfaooooo y’all are funny, the cops don’t do SHIT for domestic violence victims. The cop that came when I called them at the age of 17 told me it was my fault and that I was wasting his time 🙃",0
3482,"@AitorxMartinez Jen Robson @suigenerisjen and K Hrafnson and Wikileaks have all my documents personal ids and address. Presecute me if i am wrong. Stella Moris, the fake partner was a drug dealer inside Ecuadorian Embassy and one of the violent torturers too.",0
3222,"It is one year ago today, that I left that awful life behind.

It isn't easy to stand up in front of the whole world and talk about your truth, but if doing so can clear an easier path for others to do the same, then it is well worth it.
#addictionrecovery #DomesticViolence",0
2222,"I was never in a domestic violence position until the day my ex lover literally beat the living shit out of me, raped me brutally. The aftermath of self healing was disrupted by an internal infection. Long pass the physical healing it took longer to heal mentally &amp; emotionally.",1
2683,"In Oct. 2017, I clicked on a link to the Shitty Media Men list to see if anyone I’d worked with was listed. 

That same semester, I was interviewed as a witness in a friend’s Title IX case. 

Nine years earlier, I became a survivor of sexual assault and intimate partner violence.",1
3963,"@mikepompeo If the pandemic happend last year my best friend would probably be dead from domestic violence. 

How many women have we lost to domestic violence on top of the 200,000 we've lost to COVID because of your administrations incompetence?",0
1186,"In my view, people who steal public funds are worse then murderers and suicide bombers and rapists, because corruption creates poverty, breaks up innocent families, leads to prostitution, domestic violence, psychopaths due to childhood trauma, seria killers",0
1654,Absolutely delighted that my union is recognizing the impacts of domestic violence as COVID has exacerbated the safety concerns of abused women and children. Hope other unions will join in this. #canlab #canfem twitter.com/pamelacross541…,0
2344,"Didn't journal for while because I didn't want to talk about it anymore.  I guess I don't have a choice.
workingongoals.wordpress.com/2020/04/21/sur…
#DomesticViolence",0
2243,"@2020IsNuts okay, compare that to all of the domestic abuse that has happened constantly over time. i am well aware that men are abused, and i clearly do not agree, but you cant say “genocide is impossible, but violence against *blank* is real” because it can be used by anyone for anything.",0
770,@AnnamiePaul @CanadianGreens Wow!   You are bent. It will increase crime and domestic violence exponentially.  I can’t believe you just posted that.  How embarrassing.,0
3118,As a survivor of domestic violence im not sure I want to see y’all think pieces on this,0
4182,@insprepositive So true. My partner and I been talking about that because this generation is full of violence and from what I went through I ain’t letting that happen to my baby girl and have to teach my future son to be a real man,0
4340,"Not only that, but inside our home we lived with and abuser. My mother endured many years of domestic violence while trying to do her best to raise 3 small children.",0
3248,"@pulte I'm getting evicted, no home and no job. I take care of family members with disability. I'm escaping domestic violence. Please someone help me RT this gf.me/u/yvg8tn",0
2103,@catturd2 @gatewaypundit I don't think that was the reason! Domestic Violence on the uptick because couples with bad history and stuck home together!,0
4225,"@amberbolderdene @oh_rqining @ArtDeska @MikuThatLoveAll @doreimi_RBLX I’ve seen a lot of proof actually, based around what I’ve seen him post and what other people post I believe what people are saying is true. And no he did not DM me, that’s like saying people victim of domestic violence are faking it unless everyone sees it with there own eyes.",0
614,@Flannsplainer @zoewhittall I work in the field of Intimate Partner Violence and courts and am so grateful you wrote this article. This is what I see everyday.,0
2405,It’s really nice not to be told everyday how shitty I am. #DVAM2020 #DomesticViolenceAwarenessMonth #DVAM #verbalabuse #abuse #narcissisticabuse #coercivecontrol #domesticabuse #domesticviolence #YouMatter,0
816,@kenyadad12 I agree.  We are in an abusive relationship and it is so hard to find the way out.  I want to keep hope alive tho!,1
3881,"@CMOMaharashtra Respected sir
  I'v been chasing domestic violence case since 3 years against my father in law and mother in law  who also physically assaulted me and threatened to kill me yesterday 26/06/20 but the Vasai gaon police station (West) refuses to take any action.",0
2798,@Steven41849941 @TemiMwale @ariettethe1st @metpoliceuk It’s been statistically proven the police are being called on less and less because of lack of faith in justice hence why (for example) only 25% of  domestic violence cases end up in arrest (Home office report 2011) so actually I think you’ll find people are better of without,0
1720,"One of the first steps in healing is educating yourself, there are 6 different types of abuse. I have written a blog to help you identify what they are &amp; how they might be shown in your relationship. selfloveafterabuse.com/post/how-to-kn… #selfloveafterabuse #narcissistabuse #domesticviolence",0
4379,"@MxneySchnee It's nothing against you as a writer. Domestic abuse is just something I don't like on my TL, and Jacques/Jacqueline is a character that partakes in domestic abuse.",0
3663,"eminem b like ""I'm white and I hate women and want to kill them"" and its like yeah guy we've seen the domestic violence statistics. we know",0
2709,"@OKen_Ishii I mean if someone isn’t facing physical abuse. as a grown adult male or female who is not cognitively impaired or financially dependent on their partner, it’s that person’s responsibility to end a relationship they want out of no?",0
4478,@LauraBockov I just watched a new episode on reelz this morning about Johnny. They are really out to get him. They made him into the bad guy. In my opinion watching it I believe AH wanted an abusive relationship. I think Johnny did it once as a game with her on the plane. Because he...,0
3477,"@Burgerm_n @jennamorrison @missnemmanuel ... social workers, protectors, providing community reassurance, dealing with victims of rape and domestic violence, people in crisis... I could go on forever. It’s a big ask and only those who have done the job can really understand.",0
624,"@day_pdx @alex_zee @UniteOregon Hi. I was in an abusive relationship. My ex saw himself as a bad boy. He’d regularly escalate with cops when we were out and was proud of his criminal record. A neighbor threatened to call the cops when she heard me scream, and my ex got so enraged that I begged her not to. (1/2)",1
1337,"@Melanie_Winther I’m so sorry. That’s horrible that you had to deal with such abuse, physically and mentally, from the person that was supposed to be your partner. I wish I could say otherwise, but yes, women have suffered at the hands of men forever. It’s beyond disgraceful.",0
1986,"@LH__5 What are you actually doing to get your candidate elected? 

Tell me his policies on intimate partner abuse and sexual assault? I'm not harassing. I want to know substantively what you know about his entire proposed plans in a complex area of US law, social serv, violence,",0
653,"I'm very disappointed in @NBCNews.  The goal ought to be more information, not less, distributed to the greatest number of people.  Counter-programming doesn't do that.  And NBC is now so cowed by Trump attacks that they react like a domestic violence ... 1/x",0
1013,9 months free and I think one of the best things I’ve learned is that NO ONE can take away my truth or make me downplay how shitty it was or change the details. #ibelieveme #Truth #narcissisticabuse #DomesticViolence #DomesticViolence #childabuse #DVAM #ptsd #cptsd #metoo,1
3592,"@AmericaPlsAwake I want to know that too. What was she testifying about?

I can't imagine allowing anyone who doesn't have at least a masters in social work or psychology being allowed to testify about battered spouse syndrome or the psychology of domestic violence perps &amp; victims as an expert.",0
1227,"Did you know- I host #AbuseTalk via @AbuseTalkOnline every Wednesday evening 8-9pm GMT. We discuss a different topic on domestic abuse each week.

#TwitterChat #domesticabuse #discussion #coercivecontrol",0
1777,@JessicaNEllis3 @Newsweek Last year my county tested just 10% of the rape kits that went intested for over a decade. They found one man was connected to 30 rapes who was in the jail for domestic violence. 29 women were raped by that pig because police couldn't be bothered to investigate the first one.,0
3159,Once upon a time I had an abusive boyfriend who would mock me for being a dreamer. Today I bought my husband a new truck with money I earned from a dream he encouraged. Gotta say was a cool moment.,1
41,"@matana_l @GrunkleBarlowe @inverlock He's the one who confessed and then tried to sue people for talking about it and lost. What other conclusion am I supposed to reach? SK isn't exactly shy about how lax it is on domestic violence, someone facing punishment of any sort for it is way in the minority",0
4487,"Two more hours. 

I was venting to my friend about my situation with work and she described it best: “That company is abusive.” And it really is. I’m in an abusive relationship with my job, and I’m so happy I decided to leave.",0
2334,@zzincz i wouldn’t be living here still if i weren’t for me having nowhere else to go once i left my abusive relationship 🥲 i’m hoping to be out by fall this year,1
4155,"@JoametteGil recorded my injuries injuries. He'd run off by then so when they found him, he immediately started claiming to he having a mental health crisis so they did nothing even though he was already on probation for previous domestic violence charges.",0
3930,"@JeffreeStar $lionessjai 

#JeffreeStarrApproved  recently left and abusive relationship with my four children. I had to leave everything behind and started fresh. Finally got approved for our own place and I could use help with furniture as I only left with a few of our essentials.",1
1427,@CoachMcGuirkMMA I got my money on domestic  violence.,0
2458,"@orangyangtidur @Wan1603 While I understand ur concern on alcohol n it’s correlation with domestic violence, I fail to understand how stopping it’s production is going to solve the problem? Most who abuse it suffer frm a deeper mental issue, shouldn’t we combat this mental issue instead of the medium?",0
3959,@KatyMontgomerie @Finn_Mackay @djunasaurus I don't know what world you live in but it's not the same one as me. I really don't like how dishonest we are about our community. Domestic violence between same sex couples. Sexual assault. Rape. Bullying. Stalking. All of this happens to us to.,0
3565,@parentchain This is complete bollocks. Domestic violence has increased because of poverty. Mental illness has increased because of poverty. Drug use has increased because of poverty. You’ve got the whole thing back to front to support your ideology. I feel sorry for any child that you teach.,0
1479,"@pigreen1 @ShresthaSubina I think domestic violence has always been so high that nothing has brought it down, so this global domestic violence ""UP"" is referring to some hypothetical ""DOWN"" benchmark, what is It?",0
1772,"@mspenguin74 Neglecting your partner in favor of porn= bad, but simply indicates problems in the relationship already existed. 

People don’t start abusing their partners b/c of violence in porn, just as we don’t after watching a horror movie. (Not that I condone violence in porn 😒)",0
4036,@ArtCrunchy I lost my self worth and strength in an abusive relationship. Fortunately I managed to find a spark of strength and got out. I found my self worth again but I sometimes struggle when I remember that I lost it for a while.,1
1099,@latoyadeshawn_ Wow smh praying for you hun. I know how it is to be stalked from a prior domestically abusive relationship. Still healing from the trauma,1
1783,"@TheLimit101 @csiblonde @LFC_blano @PatriotActive66 I mentioned army to show that rape, violence is everywhere, among army, police, teachers, nurses etc domestic violence is under reported",0
347,"@kelittlejohn It’s a horrid cognitive dissonance I find myself in. I strongly believe it’s 2 soon 2 return kids 2 school or ease restrictions, but I feel equally strongly that the rise in domestic violence necessitates it. Every day I am aware of our privilege not having 2 juggle work &amp; child.",0
4522,"“Sure, there’s bad things about Australia, but that’s not what Australia Day is about. It’s about celebrating the very best this country has to offer. Now, if you don’t mind, I have to give an Australia Day honour to *checks notes* a domestic violence and child abuse apologist.”",0
2498,She chose poorly though and trying to defend her poor picking but like I said I don’t support domestic violence. I acknowledge she can’t control him hitting her but she could control leaving twitter.com/robinwannabefl…,0
2,"Protect the children

Parents should protect the children

Love the children sincerely

Violence is not good

Love my child from my heart

Domestic violence stop it

Love children from love",0
2785,"@subhajit2682 @YoursLegallyy @RGVzoomin Buddy I totally agree, there is domestic violence on men as well. But again, my point is how are you relating women buying liquor to it?",0
1830,@Fether22 @richardm56 @RefugeCharity @safelives_ @STagainstDV @Telegraph As a survivor of #domesticabuse abuse I can also say I am eternally grateful for my neighbours who rang the police...they saved my life! He was also convicted of that one. Please don't assume anything...abuse takes many forms! Always report,0
2424,"@SethMacFarlane This is all true but domestic violence has increased in the wave of this pandemic&amp;I have forgotten 2 put on my mask quite a few times bcz I'm 2 upset from having 2 deal w/abuse. People think they can spot a victim a mile away. This simply is not so. DV victims don't have a ""look""",0
3395,#CNNTownHall w/@ewarren had a question about ##gunviolence which she mentioned #domesticviolence where abusers have weapons. Some feel my sperm contributor shoulda used his gun vs his fists n his abuse on my mom who succumbed to DV trauma. Both are deadly. youtu.be/s7PdlgiL2lI,0
3924,These issues of domestic violence hit so differently when the victim or the perpetrator is someone so close to you. Now I understand why most cases are swept under the carpet.,0
2118,"I have watched the news today but have realised how our society is bleeding wit sex abuse, sailing in domestic violence, its too much God help us.",0
2583,"@edlavis88 @pat_aussie @cieletetoiles @aeirould @TheSunUS I'm not using it against her. I am questioning why she brought it up now.  How dare she use this as a way to escape scrutiny for the awful things she has said about trans people, when so many people like me have gone through domestic violence. THAT is what is really disgusting.",0
3202,having my regularly scheduled rumination on the fact that the single best way to stop mass shootings--banning people with domestic violence records from owning guns--will never happen in america because you'd have to fire at least 40% of every police force,0
