,text,label
332,"Just attended a press conference with Senator Anne Ruston who is announcing a $20m no-interest loan scheme for women leaving domestic violence. Despite the cameras, I was the only journalist. #withAAP",0
3690,@AlexisMooreEsq @Change I know because I have had three traumatic brain injuries and now have post concussion syndrome from taking so many blows to the head. This is my story: abcactionnews.com/news/local-new… #domesticabuse #DomesticViolence,0
669,"Me: Shouta Aizawa = good boi, pretty boi, soft baby boi that needs loves and cuddles and attention. He deserves the world and more

Also me in the same breath: aight so how am I gonna torture him next? Kidnapping ? (Gang?)Rape ? Forced prostitution/slavery ? Abusive relationship?",0
389,"@Dominic__Noble Honestly, I’m on your side on this, Dom. I believed her too. I’ve literally had a male relative be arrested for domestic abuse when he was the victim because people automatically assume the male is the perpetrator, and I still believed her when the allegations came out (cont)",0
839,".@SenMarkey “My name is Elizabeth Schon Vainer, and I am the director of JF&amp;CS Journey to Safety. Survivors of domestic violence and their advocates are relying on you to enact another COVID-19 relief package. This package must include funding for domestic violence survivors.",0
1925,"@BenazirJatoi @sherryrehman Respected Mam
You people just playing with innocent women n with their rights. You people should remove the reasons which are causing of ""Domestic Violence""

Sorry
You cant understand my point

Its something bigger than your slow n sleepy politics

Keep making short term planning",0
2062,one day my step father gor arrested for domestic violence for hitting my pregnant mother &amp; hitting me for defending her. i was beat black and blue &amp; i was a 5th grader.,0
4132,"@funmiistic @abob_f @markadefolawe @ugwumCee 2 add dt something is being ""done"" abt hetero relationship domestic violence is 2 rub shit on d myriads of women who suffer abuse at d hands of dr husbands. 

I really hope u are not one of ds people dt tell ds women 2 ""pray for their husbands"", instead of leaving an abusive man.",0
371,"[ Police Station ]

Girl : I want to file FIR against domestic violence.

Police : Who is your husband?

Girl : I'm not married yet, but I know my husband will beat me.

That's story of CAA-NRC protest.",0
1862,"In true abusive relationship fashion,  my job is threatening me that I'm not good enough to find something better...guess what...I'm about to land an awesome job, so bye. #iknowmyworth",0
1676,Now playing Cardi B I Became a Stripper to Escape Domestic Violence (1).mp3 by,0
296,"Researching some longstanding precedents for a domestic violence hearing tomorrow, and sometimes I wonder if the guy who had a horrifying break-up from his same-sex boyfriend ever thought that, one day, thousands of lawyers would know how horrendous that relationship was.",0
4279,unfortunately they don’t give a fuck. same with domestic violence victims.  I know from first hand experience. twitter.com/SimplyMNicole/…,0
1869,@MercurialMiss I think that is a domestic violence waiting to happen.,0
538,Please I’m trying to help a woman has suffered domestic violence and she finally ran away and her so called husband is threatening to kill her to take away her son .. I dunno who to contact,0
2069,"@mdkalk Yamhill Pub is almost halfway to the goal!  Every $5 or $10 helps! Help this mom and pop, downtown dive bar stay open.  They were a safe space when I was in an abusive marriage.
#yamhillpub #portland #smallbusiness
#pandemichelp #domesticviolence #divebars
gofundme.com/f/help-save-th…",1
672,@LottieLovesUK1 Yes my ex claimed she was a victim of domestic abuse and got pregnant and her partner walked as he didn't want a child then only wanted 1hr a fortnight contact.. She lied. Then turned the same guns on me.,0
2802,Here’s my letter: The U.S. Department of Justice released a memo on its website regarding gun safety due to an increase in gun sales and domestic violence cases in the United States. (1),0
177,@allyrx7 @ReallyAmerican1 @LindseyGrahamSC I don’t really care for Trump as a person either! I wasn’t voting for a fishing partner or bowling buddy! We needed someone who knew there were problems in DC and would try to fix them! Plus he had to be strong enough mentally to take the abuse from the media and politicians who,0
2731,@GeorgeTakei Might want to check the facts. Healthy kids are at nearly 0 risk and I’m pretty sure the parents of sick kids won’t take any risk. Should I conclude you support the idea of increased financial distress that results in domestic abuse and suicide,0
2801,"@DCampbell8899 @Rob_Fleming I started teaching at the same time I left an abusive relationship with my kids' dad so I'm unfortunately extra sensitive to the abuse that comes with the job. I've tried to mitigate &amp; figure out how to make it work, but I've never been successful. At least I know I tried.",1
3602,"Susanne Strand, Örebro University, Sweden now at #SafetyBeyondTheCity

On policing #IPV intimate partner violence in #rural and remote areas; challenges, experiences, risk

Om polisarbete #IPV intimt partnervåld i #landsbygden och avlägsna områden; utmaningar, upplevelser, risk",0
4430,"@JohnDavisJDLLM You could fill a book with the lies they've told. Apart from what @Oneiorosgrip has already noted, I'd add the myth that domestic violence is patriarchal terrorism, the rape culture myth, the myth that men oppressed women all throughout history, etc. So many lies and falsehoods.",0
1735,"@LanceStorm Many of us don't care for them. Be married for 23 years, Women are better than us Men. If I wanted to see domestic violence, I would piss my Wife off.",0
1093,"i was lucky enough to get out of a abusive relationship, but with this isolation some people arnt 

116 123 - suicide hotline 

08082000247 - domestic abuse hotline

please stay home and safe",1
4313,"@pohutukawa @HowardSteen4 @YouTube Domestic violence increases (which we saw sadly), possible suicide increases (which we didn't thankfully), job losses, business closures, economic downturns. I think that's a broad brush strokes picture of the potential ramifications.",0
534,"@KathyBurke I'm 66, retired, healthy, and solvent, I can keep in touch with my kids and grandkids without having to see them. This is going to be 1 or 2 yrs out of my life. I'm not in a war zone, I'm not a refugee, I'm not trapped in an abusive relationship. I have nothing to moan about",0
4327,"@Tj_dtruelight First of all I'm not a lady, and secondly anyone can make mistake in life, most of you condeming this guy are living under same roof with abusive boyfriends and husband, but then no camera to capture d incident, d question here is, should we totally condemn som1 koz of a mistake?",0
380,"TW:: domestic abuse

my likes right now consist of tweets from a recent storyline in eastenders that involved domestic abuse. please, if you are effected by these issues, avoid my likes or blacklist the hashtag #/eastenders for this weekend. I would hate to upset anyone x",0
4520,"@Nitephoenixx @Vincent56452972 @mjwburt @careystrombotne @TimRunsHisMouth @HillaryClinton Literally nothing has happened to social security. I would know, I am on it. What did he lie about environmental protections? How were domestic abuse policies relaxed?",0
2508,"@osokigon @22_adc 😂😂 nope, she avoided that question too. Honestly if she'd have just told us the red flags and why he doesnt look like an abuser she would save half the worlds problems, we could finally know what abusers look like when they aren't wearing their 'I abuse my partner' badge",0
620,"@osteopor0sis Well just focusing on that particular scene, I feel like she could’ve reacted a little better. That was something that he did probably 20+ years ago and shouldn’t have to beg her forgiveness. Now the domestic abuse she probably will break up with him",0
222,"When I told her that, she basically told me to ""not talk to her about abusive relationship bc she had been in one and I had no idea what I was talking about"" and that I should stop ""giving her so many excuses and just answer the fucking texts."" So... Yeah :)",0
3186,@attcknq @Jeridiculous @Fridacashflow69 @alyssa_schoener The original tweet was about a man displaying violent behaviour near his partner in response to being caught cheating. As someone who has “played” the victim of abuse in a relationship I find it amazing how people can find ways to place blame on anyone other than the violent man,0
3818,"I grew up in the age when husbands were ""wife beaters "" and wives ""wore the pants. "" Fights were common. Nobody called the police. It wasn't a crime. I'm thankful to Joe Biden and all the women who were featured at the DNC tonight, for giving domestic violence a name.",0
123,"@OtsA20 False narrative.
It is common for the male in domestic violence cases to claim that they were assaulted, typically a result of the woman attempting to defend herself. In over 20 years of experience investigating DV, I charged 1 woman; 1 out of of hundreds who was the abuser.",0
1702,@HELPUSA I m domestic violence women living in help USA Woodycrest apt clean and sober being harrasted by two men tenant's need help tom headline please help,0
378,@NoBlood4Hubris I am also a dramatist (22 screenplays with female leads) and also involved in PTSD (I run two networks for survivors of domestic violence). Howdy.,0
1843,"Dear men in my mentions, men making BDSM jokes about domestic violence will never be funny. Just plain stupid. Bilawajah itni thandi jugattayn mat laya karo merey mentions mey.",0
4335,"@redlittlehorns God, I hate these kinds of people and the worst part is that they're always like ""if you don't hate your partner a little you don't love them"" excuse you????? Why are you with someone you hate wtf is that about?? Is this some het, abuse related thing??? Jesus fuck",0
3767,Domestic violence is not a fcking joke. I hope Pavithra is doing okay,0
1979,"@snoozygoose So hard, you must be completely honest with your children. I got away from my abusive husband 5 years ago and my 13 year old daughter decided last year not to see him anymore. She’s never been happier. Or stronger. It will happen children understand more than you realise.",1
360,@FHankenstein @NewsWithKevin I say this as a crime victim (assault) &amp; as an attorney who has sat with clients as they reported domestic violence incidents. Some of the officers who have been criticized for use of force have also been the best at dealing with DV victims. It’s not as simple as you think.,0
1141,@GoalsGaloreIzzy @Leigh_Gaunt @Blackers147 @patel4witham Thanks but I don’t need your education. Rather I think you need mine. Unless you mean to tell me you’ve been the victim of domestic violence and have been through the process unprotected. You went through a whole lot of reasons why PP wasn’t too blame and none of them stuck.,0
2147,"@Paleonut_ @donttrythis What about the preventable deaths caused by a months-long shutdown? Everything from domestic violence to child abuse to suicide to starvation to lack of access to health care for non-Covid ailments. Not trying to troll - it's a question I haven't seen answered, or even addressed",0
234,why do men hit women? what do they get out of it? why does someone wanna detroy your peace by hurting you in more ways than just one... if u have ever been in an abusive relationship just know ily and i stand with u one day someone will beat the shit out of them like they did us,0
3891,"As director of @kona_connect’s effort against domestic violence, it’s so great to see my alma mater @rutgers making strides in ending gender-based violence globally. #16Days #OrangeTheWorld #DomesticAbuse #EndViolenceAgainstWomen twitter.com/darrenwalker/s…",0
2714,@coldjiangshi I'm sorry but if a woman responds to her getring hot and heavy by spreading her legs and queefing in my face.......im sorry but I'll have to commit domestic violence now,0
1703,"@hmmuigai @Dotavyo @Msnyaguthii This is not a guarantee you can’t end up in domestic violence kind of situations, but I agree we all need to look out for the red flags 🚩 before going through the commitments",0
4065,"@theveganparent I was in a court in Ohio and up here in Ontario we take different approach.  In a complaint by anyone of domestic abuse the police charge not a complainant or victim. Charge are not withdrawn TIL after therapy ,",0
2934,"@iji43211 @Dismal_Bismal I can almost better you that this is one of the extremely few times you'll see this happen in Nigeria or West Africa as a whole.

Domestic violence? Happens everyday.",0
2764,"after made me believe that being in a physically, emotionally, and mentally abusive relationship was ok so i would like to sue anna todd for retribution payments bc of the trauma i endured by thinking that shit was normal. thank you",0
2349,I have to make 180$ before the 12th of January just so i can get to my fucking court date as if thats even humanly possible for me like honestly im ready to just end it all *brother and parents blamed me for my abusive relationship told me my fractured jaw was my fault-,1
3511,"@MphoMolepo_ @SmangalisoOmph1 Perhaps, however I fear domestic violence would hike",0
1329,@kurteichenwald I see this in my younger relatives too.  It’s like a kid watching an abusive relationship then blaming both parents for the dysfunction.,0
1945,@RebekkahbluE I just hope the necessary measure has been put in place to ensure that this incident doesn’t repeat itself. Violence against humans not just women must stop. It’s inhuman to abuse any human let alone your partner. This act is highly condemnable.,0
3546,@RaelynnKahani Why do they feel the need to attack Carol tho? It ridiculous! And making a joke about domestic violence they are sick in the head. I don't understand why it's there obsessed with it. Like I'm not a big fan of Ezekiel yet I ain't talking about it all day. To much negativity,0
3906,"Anyone else rock some PTSD from a past emotionally abusive relationship that jumps in every now and again? Mine came this morning when hanging the washing, I used to get abused for not ""doing it correctly"" and be called useless for it. 

My wife now just appreciates me doing it.",1
3778,"@Thee_Roxy_Cox @FunkadelicHorse @TheBodyShop @jk_rowling @paisleycurrah Absolutely, definitely NOT! However, it seems the theme of JKRs tweet and ensuing comments was domestic abuse so it appeared a bit off beam? Correct me if I have misunderstood please?",0
849,@ITaughtEm_Dat Then ON FACEBOOK 🤦🏾‍♀️ I asked her is she suffering from domestic abuse,0
3426,"Hey guys, thanks to everyone for the kind comments and messages,I was a bit low and drained yesterday but I'm thankful it created the discussion. I will set up a discussion on my social media and bring guest experts on. Domestic violence is also a topic someone wants to discuss❤",0
1049,"@Dream_koalas @whoisitbad As a domestic violence survivor do you know how many times I've used humor to cope with shit? Yeah way too much. But at times if I disnt laugh I was going to hurt myself

While I covered up for my abuser I made jokes Fuck off Theres LITERAL voice recordings of her admitting it",0
1785,"Murder, domestic violence, sexual assault, bountygate, helping cover up sexual abuse, those are all okay but I swear to GOD if you kneel during a song twitter.com/AP/status/1220…",0
1239,@adesadesayo That’s what shalewa didn’t make clear love! No one  would like to stay in an abusive relationship I doubt Tito would seff,0
3762,Do any of you people know how hard it is to leave a mentally abusive relationship? Honestly it felt like I was stepping on eggshells most of the time because my partner would say she would want to k!ll herself if I broke up with her and that she wouldn’t know how to move on,1
4470,"@allygrainger Yes I became an author during 2020!! After transforming my life from addiction, domestic violence and mental breakdown. Will DM. Jen",0
3993,@bethanybodyart @cemcg11 @Dear_PruD You're right! It wouldn't be a bad idea for a boss (or anyone) in this position to call a domestic violence hotline and just ask: what's the best way to handle this? How do I best protect her dignity AND her rights?,0
3206,"@DankkGiveaways Please help. $825 still needed 🚨 At this point we need a big miracle to happen. 🙏 Trying to raise as much as I can by 8-25-2020. I'm raising money for New Life for me and my son. 
#DomesticAbuse #AutismFamily
Anyhelp would be greatly appreciated.
 $HomeSchoolMomma6",0
4454,"@Finn_Mackay @ladylaxton Yes ago, I worked with a woman-multiple children, alcohol/domestic abuse. Given a new identity &amp; home, in a new location. Told that if she remained with partner, her children would be removed &amp; adopted. 20 yrs on-she’s still with him. Despite every effort to support. 1/",0
1853,"One year ago my divorce was finalized. One year ago i was finally free from a toxic and abusive relationship. Even though we had been separated since 2017, i still felt tied down simply because of legality. This year, i am I’m a relationship with someone who loves me, who cares",1
1966,I keep getting memories on my snap and my face was the size of a truck at this moment last year.. so glad I got out of that abusive relationship.,1
2368,@IainDale @campbellclaret Am I wrong but the movement of young children during lockdown was added after campaigns on domestic violence  and not intended for other purposes #cummingsbriefing,0
4146,"@Pumpkinz16 @BOBERTCOL @theJeremyVine The UK is not alone but most countries are doing differently. I can understand both arguments but I would question how prepared is the UK for a month long closure? How many deaths due to domestic violence, hunger, homelessness would be acceptable due to government actions?",0
455,"“And then there’s the gambling-related domestic violence, family breakdowns, mental ill-health and homelessness.” I can attest to this too, from people I’ve ministered to over the years.",0
1462,"With our duty/obligation to quarantine, apparently some PDs have way more calls for domestic violence.
I think that if you're being assaulted, fuck the quarantine, get to another safe place. I know you love him/her, but when it gets physical, you're more important.",0
1169,"I had missed my abusive relationship with Orlando Pirates, I'm excited that it's back. 😁😅",0
1996,"@davidhogg111 @CoryBooker As a survivor of domestic violence, I am alive because I carry a gun and have a well-armed home.

Violence is the problem. Not guns. #2a",0
178,"@bellanciagga I will say Tess is not a lovely person (scamming followers, using the National Coalition Against Domestic Violence to sell her T-shirt and then not donating any funds), but EVEN THEN there’s no need to be posting people on here and exposing the community. Keep that shit to urself",0
2327,"As a victim of #DomesticViolence I'm terrified to call cops about my ex showing up at 11pm to bring our child gifts. Cops will tell me I'm being unreasonable, they always do, they always help him. I don't trust cops to keep me safe or alive against my abuser. 
#Alone",1
200,"@KawaiiMommii Omg...big hugs...sorry that you’re going this and domestic violence is not cool...not to get off the subject, I remember when my cousin’s husband assaulted her in front of her and he was arrested immediately..then he released on bail and when my cousin’s husband",0
236,As we are dragging this rape issue I think we should talk about this issue of domestic violence that shit is real and killing people 🤔😕,0
675,"Celebrating a year out of my abusive relationship, feeling thankful for everyone who's helped me on the other side of it. Finally starting to feel comfortable &amp; happy in my own bones again x",1
2570,Alienation is the most horrific form of abuse I have ever witnessed because it destroys the targeted parent but it also destroys the innocent children that are weaponized. We must create awareness to end this form of intimate partner violence and child psychological abuse.,0
1292,"@Zirafa_Na_Pajdu @jaimesalinas1 @adriandelmonte I have no idea about the extent of her injuries, but yes, if he'd put a lot of force behind it, it is possible he could have killed her. The thing about throat injuries is that they can kill you some days later, too. That's why choking is taken so seriously in domestic violence.",0
2110,@shadesofghostin @NASABMB @NICKISTITZ @industryminajj @chartdata @LilKim And my guess is you're pro domestic violence otherwise you wouldn't have liked that shit. Lil Kim never wanted to get beaten nearly to death,0
1144,"@AlanHJamieson1 Me too. Anybody want to take a knee for the rape of thousands of young girls in the UK? Victims of domestic violence. Victims of sectarian violence.The poor kids that go to school on an empty stomach (as I did) inadequate clothing in the winter. Disabled, disenfranchised folks.",0
1665,"I'm from a red farming state and I saw these characters as transcending hillbillies to people around me with domestic violence, drug addiction, no hope, towns, dying but voting red anyway. twitter.com/Mary_Chuff/sta…",0
4054,"@Hal_Duncan Yknow what’s amazing to me? These are the exact same motherfuckers who argue a sexual partner “never really *saying* no” means no abuse could possibly have taken place, and by amazing I mean I literally want to start screaming and never stop",0
520,"Each Wednesday evening 8-9pm GMT I host #AbuseTalk via @AbuseTalkOnline

Tune in and tweet. 

#domesticabuse #domesticviolence #support #TwitterChat",0
1787,"Here's part of a thread about intimate partner violence I posted last night. One thing I learned in the process of gathering sources for it is that there are a number of sites, like the one linked below, focused on addressing abuse among teenagers &amp; young adults. twitter.com/ana_mitric/sta…",0
125,"@SergeantCity Sorry, Sarge, vandalism, theft,  burglary,  even domestic violence shouldn't come with a 50/50 chance of a death sentence.   Not even a 20/80 chance.  I am presuming of course they aren't releasing sex offenders, murderers or child abusers that resulted in a death.",0
4413,"@NetflixIndia now that everything is shut, I missed the opportunity to watch #Thappad in theatre. Please bring it to Netflix so people can entertain and educate themselves on domestic violence during self quarantine @taapsee",0
3992,"tw: domestic abuse

joking about someone being domestically abused is wrong on so many levels, you talking about tessa’s eye yesterday made me so uncomfortable but I thought I was being overly dramatic, it’s another day and you all are still implying that she’s being abused?",0
1628,"@JoametteGil I had cops called on me when I attempted suicide.  My brother is a cop and most of what he responds to are domestic violence calls.  Still, I totally understand being nervous and distrustful of cops.  I myself get scared around them.",0
3498,"It’s crazy how a mf can go “It’s 3 sides to a story” and then all of a sudden, “ You Condone Domestic Violence “ or “Justifying abusing women” NO...NO ....NO...I don’t condone women abusers, Physically  or Verbally. It’s just asinine to take a side without knowing full truths..",0
2779,@goodyweaver @mimasdiaries This infuriates me so much. How many men out there are being abused and refuse to talk out of shame? I wish all domestic abuse victims were taken seriously not just women.,0
2237,"My neighbor a few doors down is a victim of domestic violence. The police came by and were trying to get her help, but she just kept making excuses for him. I feel so bad. 😩",0
1574,I get the feeling people think sexual abuse and domestic violence and other crimes against women are not actually crimes that need punishment as they go on the attack of anyone saying otherwise,0
382,I'm in an abusive relationship with research,0
2436,I'm really struggling tonight. I finally have opportunities for sex and me body is no longer cable because of vaginoplasty. And what surgery didn't destroy domestic violence and spousal rape did.,1
4211,"#EachOneReachOne
I recall our househelp had come in after a long break. Battered and bruised and a nervous wreck. Offered to assist her in lodging a #domesticviolence complaint.. she was reluctant. 
Unfortunately, our social conditioning prevents women from seeking justice.",0
2518,"@nfl supporting #kneelingforflag #defundingpolice in name of #justice, but have done nothing just make commercials for #domesticviolence ticket sales are needed I WILL STAND FOR THE FLAG SO U #NFLPLAYERS @nflcommish CAN KNEEL &amp; have freedom to play a child's game. #Americafirst",0
4511,@aproko_doctor @sainttracys Pls how do I handle domestic violence. I'm going through one now.,0
3504,"When I was 22, my then-husband became more and more abusive (often while he was drunk), strangling and hitting me, locking me out of our flat and making me feel like everything bad that was happening to him was my fault. (8/15)",1
2538,"@NYGovCuomo @Headspace No $hit, Sherlock. I can't for the life of me, imagine why. Nothing to do with those Domestic Violence  Partners being forced to shelter in place, though.... is it? 
 No Work? 
Rationing of food? 
Kids at home?
Need I go on?",0
2573,"@ColtDelgado I love that you can infer that his marriage failed and his kids want nothing to do with him since he's eager to escape it all, which really tracks with his abusive relationship with the tree. Also probably has mommy issues since, y'know, the tree.",0
