,text,label
1357,Marriages lasted because women were taught and advised to endure bs that comes from men i.e. infidelity and domestic violence. Women now are educated and more independent hence they don’t have to tolerate bs. I don’t condone divorce but I don’t condone abusive partners either 🤷🏽‍♀️ twitter.com/royalties_pc/s…,0
3317,@earth2ashx @LivinADreamLife @defnoodles Vague assumptions I’m taking about the outright offensive LIES That are forever one tape not assumptions the domestic abuse she did is also on tape and photos not assumed ..  get your head out of her ass! 🙄,0
3724,"⚠️ If you're a victim of #DomesticViolence, there are lots of places you can look for support. 

You can find updated advice on our website ⬇️ advicewestsussex.org.uk/i-need-help/co…",0
2958,"@KarenAttiah Intimate partner violence crosses all races, income/education levels, genders &amp; sexual preferences.  I have attorney friends and colleagues who are survivors like me. Narcissistic abuse is on the rise, and trauma bonding is real. #EndtheSilenceandShame",0
2250,"@catturd2 I see a lot of divorces , and sadly child and domestic abuse before this is over . People can’t be cooped up forever . Not to mention  change in routine less physical activity which leads to aches and pains (arthritic issues etc etc",0
549,"@psychdr100 @dc_tribune I think of him as a domestic violence abuser holding us all hostage. If I am wrong, explain why.",0
3515,@Betsypaige24 @angelalevin1 Wonder how my kids and I were supposed to cope with domestic violence.,1
1307,@uwimano @KinguHasna @FlavianaMatata @MkutubiRajabu Yeah i get what you are saying..but we should not normalize domestic violence because mtu ni mjeuri or whatever..You know pia men can be really rude but since women hatuna nguvu ya kuwapiga we result to other means..let men do the same..all these killings will end.,0
2790,"TW parental abuse
*
*
*
*
*
Here I am, feeling incredible emotional because my partner gifted to me a kitty plushie. Bc my parents always bought me something random or gave one of my sister's. 

Sounds ridiculous, I know, but I always felt that none of them really cared about me.",0
3091,"@TristanWeber97 I'm sorry you went thru that too. The unspoken,  unaddressed epidemic is domestic abuse.  SUPER HOPEFUL that UBI will alleviate this chronic epidemic",0
3443,"@PeterPsquare Mr P, I'm just a fan of you whom who have mentored to believe in himself, say no to domestic violence and never let third party push me to fighting with my wife. Bless me too 2034117765 UBA. The money I presently have is not sustainable enough to make me stay home till next week.",0
4521,"@Remember2ndOct He had some very inspirational dialogue/tagline .... I think it was ""Together we can &amp; we will"" and ""India's Most Wanted .... India fights back"". Wasn't he arrested for some dowry or domestic violence case .... Were they fake ?",0
2828,"@slaveBadBaby Sarah Dessen was my favorite author ever! She has so many amazing YA novels that touch on all kinds of topics like relationships, domestic violence, divorce, fitting in, blended families and more that were so important to me growing up to get to see",0
51,@piersmorgan Can I also add that there are men who are also under the threat of domestic violence - if is horrific regardless of gender.,0
3245,"I scroll through your tweets daily. I hear your anxiety, struggles, feelings of depression and disbelief. I hear about your sleepless nights, enduring nonstop verbal attacks/lies, and your fears. You, my friend, are in an emotionally abusive relationship. So am I.",1
1454,@CNN A new form of domestic violence. LA Galaxy gags wife of an employee. What’s next? LA Galaxy lords over wives gyn appts &amp;drinking habits? Allowed to have their own bank accts? Hey what if they want to vote? Do they surrender their first born? I mean their husbs do work for you.,0
1615,"@njsports4 @ResistOrDie2020 @LawofNumber @davidhogg111 But I could have compared it to ANY crime: ""I don't understand how someone can think an abuser will follow domestic violence laws!"" So let's just do away with DV laws?",0
2144,on this exact day at this exact time 9:31pm i left my toxic abusive relationship for good last year.,1
1641,"My first thought were that there would be war. That this would damage young men’s souls. The end result would be increased domestic violence.

What I didn’t guess is that we would create such a militarized generation that we are seeing now as citizen militias and violent police. twitter.com/chrislhayes/st…",0
4156,"I don't condone domestic violence, but sus shouldve never threw that apple. She damn near took his head off.",0
831,@MaryThorn85 @mir_ocall @MaryKenny4 @MichaelKellyIC @Independent_ie A lady named Bridget died in 2015. She was one of the last ladies to have lived in the Magdalen refuge. I think 18 women stayed with the Sisters after the refuge closed in 1984. @COPEGalway will look after women experiencing domestic violence.,0
903,I just got out of an abusive relationship. I don’t know how to deal,1
1343,@NICKIMINAJ Just want to make sure I understand...u DON’T agree with domestic violence... but u DO agree with pedophiles... cause u talmbout “alleged” like he didn’t just get sentenced to 25 years and shit... also... you married a rapist... just trying to figure out where you draw the line,0
1147,@Sizzibeth You definitely deserve the bubbles. Getting yourself and your kids away from an abusive husband or partner is a difficult decision to make for so many. I just want you to know how proud I am of you. 💞,0
3155,"@thesolaallyson Raping and domestic violence...battering our wives like punching bags...which one worst pass...see women are suffering and it's high time women voice out,am a man but I can't stand the fact that most men don't value women at all.",0
1793,"To add to it I attended a domestic abuse incident whereby a woman had thrown a glass at her partner injuring him. I was with my sergeant at the time, and she told me not to arrest her, even though the woman admitted what she did.",0
2086,@4theluvofJEN so you a domestic abuse survivor huh i applaud you for leaving that situation i really do i to was abuse survivor,0
3962,Any woman that will be a victim of domestic violence in this period I say may hell fall on the man will be perpetuating such evil without understanding the importance of that woman.,0
1355,"@VM_Sigh @MzCreole_Doll @Khan_azwaSrkian .
Which country are u from??
.
I wanna go there...
Coz in my country.... domestic violence is accepted,girls are openely raped on the name of honor,girls are forced to cover faces on the name of GOD,some aren't even allowed to go school!!",0
2629,"Excusing personal traits as ""that's who I am"" doesn't help us grow and become more like the person we’re created to be. This is a concept we share with #domesticviolence offenders who are working to stop their harmful behavior. Thx @CThrelfall and @TGC! thegospelcoalition.org/article/person…",0
1383,"@emrazz Ok, but Men have huge Problems to. I know that alone doesn’t disprove that feminism helps both sides, but I‘ve never seen feminist talk about some of the Issues that men have where women are better privileged. For example: Education and Partner Violence(Im not a native tounge sry",0
1182,"It's great to see this new law being employed, however I hope it will be dispensed equally because domestic violence and coercive control are not solely male traits twitter.com/paddymacc1/sta…",0
3856,He had the nerve to say “No”!  That ish felt like verbal domestic abuse! I was in shock! So much so I said 😕😳 “Huh?”,0
3607,"@AndrewTheCub @ihysteph Its not how it works. Please read some information, literature, interviews about the domestic violence and abusive behavior, rather than trusting that stereotype. If you want, I can DM you them.",0
4168,"@JennyLauren26 @RLopez00025 @BeckyHop13 @enews And Paris is not just a victim of institutional violence but also domestic violence.. A point that highlights the fact that ANYONE can be a victim. For people to say ""I'll pass"" on supporting a subset because they have privilege in one aspect of their life is beyond hypocrisy. 😏",0
650,"@greattweetsam Oh i thought it was clear, you love osu football but don’t like domestic abuse i was just saying keep that energy",0
2510,"@tallanarchist @LifeLiberty_ @RealJamesWoods No! What it makes them is in charge!

Thats the problem in this country!

Millions refuse to accept law and order because they think they are special!

""I have felony warrants, I raped people, cops here on a domestic violence call, I don't have to listen them because I'm a 'G!""🤮",0
592,"@Mayssana4 @SimonHarrisTD @CMOIreland @NursingHomesIre Wasn't a threat for me,with mental health and underlying  condition? I'm not complaining.I'm staying in and how I'm staying in ,I guess others can do so. Asking for easy restrictions won't solve the domestic abuse,Garda will do it instead.  So will do the Gp with health issues.",0
878,"#maritalrape #fakelove #domesticviolence #women #womensafety #microtale #shortstory #indianwriters #englishquotations #womenlife #mugdhafakeerquotes 
 
Read my thoughts on @YourQuoteApp #yourquote #quote #stories… instagram.com/p/B9JAIjgHu70/…",0
2098,"“How do you feel carrying that burden?”
“I weep while writing about her.... When something good happens, for just a millisecond I think of telling her....”
As a former prosecutor, I think this should be required reading for a DA’s office. #domesticviolence bittersoutherner.com/features/2020/…",0
856,"@SexyAssPatriot2 @jagocide I know people that aren't even near the military that have PTSD. It can be caused by rape, car accidents, domestic violence and many more. I've helped hundreds and also train 1st Responders on de-escalating situations where they have to deal with someone with PTSD.",0
2180,"@eNCA This is really not good news.  Nicotine withdrawal is medically proven to be tougher than heroin withdrawal.  Domestic violence, which will affect children, will escalate. BTW, I am not a smoker, just a concerned citizen.",0
3379,@superscriber Nah- we’ve been married 41 years this year &amp; I adore my husband as much today as when we first met he’s a good man &amp; has supported me throughout my career working in women’s services and domestic violence now as I write my PhD. He’s my mate and best friend,0
4241,@OneNationTory4 @kate_makinson @Bullseye_Fan @NikkiStix55 Because their mother is certifiable lunatic that thinks happy children are an issue and telling someone to commit domestic violence is acceptable. I hope they have photos,0
2730,@chrislongview I helped a client today who is a domestic violence survivor. I can't go into details because of confidentiality but I'm really happy about it. I do this every day but sometimes there's a client that just makes me know I'm doing the right thing. I felt that today.,0
1118,"Any articles tracing the #challengeaccepted hashtag? Saw it first used by women in Turkey as a way to protest TR’s plans to exit the Istanbul Agreement against Domestic Violence (with approproiate hashtags). Not saying that’s origin, just my circles, but would love to read!",0
3120,@CovidAction THIS is the issue I am MOST concerned about #domesticviolence #COVID19 #lockdown,0
3389,i’m done arguing but if i catch y’all on here overindulging in alcohol i’m coming hard with the death and domestic violence numbers when it comes to Alcohol 🤷🏽‍♂️,0
1377,"Y’all, the girl I interviewed with messaged me to say my story has received the most traffic to her site and because of it others are reaching out to share their stories about surviving domestic violence. This has been my goal to help others share their stories❤️",0
217,@TheInfamousOne6 I was in an abusive relationship with someone my family and friends believed was a great guy. He sold it well to them while controlling everything I did. I couldn’t talk to anyone without him there. If he hurt me I wasn’t allowed to leave until the bruises were go e,1
553,@Fearnecotton I love you Fearn but really 3.5million Dads are cut out of their child's family purely because they are male. Then the twats that take over from them are statistically more likely to cause child abuse. Then the Mums then domestic violence is 50 50 and I've never seen a man being,0
2927,@GeorgeTakei My mental and emotional health. I'm healing from Trump's abusive relationship with America.,0
1524,"@hloni_maniers 100% there’s no room for spite in partnership , and it’s true that people will abuse that . 

Personally my career could well be an expat one , so a partner whose job allows him to work from anywhere would be ideal for me . He can provide stability for the kids and grounding",0
310,"@soopagaz @DeeMeanz Why I'd grass: domestic violence, child neglect, drug dealing, racist and/or violent behaviour that endangers others. CV-19 limits? Nope. Let them deal w/ the consequences themselves.",0
1852,"and red county and flint county are back together like an abusive relationship, not too dissimilar from the one i just got out of",0
3982,"Domestic violence is on the rise. In the CO House, I voted to penalize violence against pregnant women while Tipton voted against reauthorizing the #ViolenceAgainstWomenAct. We can't trust him to take safety seriously, whether or not we're in a pandemic. cfr.org/in-brief/doubl…",0
1952,"There’s a lot of things I can overlook in a relationship . 

Domestic violence or any form of it is a top 2 deal breaker for me

That includes damage to property as well, because it’s domestic abuse . 

Anyone who has to resort to a display of violence is not the one .",0
1896,@jameyvinnick9 @RM_Preston He came and yelled at b/c Leaf got arrested for domestic violence and said that I was excusing the behavior b/c he’s a Coug. Said I being racist towards UW players getting accused of sexual assault. I had no clue what he was talking about.,0
1340,@Meg4Congress I don't know about anyone following me but I would love to talk with a candidate about the issue of domestic violence.  It has more than tripled in the last year and something needs to be done about it.  I am not only a survivor but also a victim's advocate.,0
1586,"Hi!! pls consider donating to my org. We help survivors.  We believe that systems, rooted in inequity, are a key factor to why survivors of domestic violence  lack the resources and economic opportunity to find safety. charity.gofundme.com/o/en/campaign/…",0
870,@c4ndytrvck @ChrustopherH I mean I went through some shit in my 20s and I managed to never abuse a partner.  I absolutely do not have to forgive abusers because they move on and trying to push that rhetoric is extremely immature. Just because you Stan doesn’t mean everyone else has to get over it,0
2331,"@ZaidJilani I assume some kinds of crime like domestic violence are going underreported, but burglaries or car break-ins aren't up too?  So odd.",0
73,eating red after so many months of eating green makes my mouth feel like it came out of an abusive relationship. my taste buds keep waiting for a beating.,0
4354,@ThomboyD Nobody controls my feelings but me. Nobody tells me how I can feel or can’t. I don’t seek permission from anyone. I won’t block or deny how I feel. I was in an abusive relationship where I wasn’t allowed to express my feelings unless they were approved by the ass hole in my life!,1
1338,"@grow_your_wings @ashley_chadwick Telling my story. Iwishdaddywasdead.com pple are reading it who knew us at that time. They are asking: „why didn‘t you tell us?“ I tried, but at that time even I didn‘t know it was abuse. Sounds crazy? Yep. It was. #narcissisticabuse #DomesticViolence",0
906,"Dutch isn’t a “fun project” for me. He’s not a prospect for anything but a partner. He’s a rescued animal with a lot of mental and emotional trauma from a lifetime of abuse. He’s never going to be a flashy show horse, that’s not why I have him.",0
270,"All I see is ""Blood thirsty"" set of religion fanatics. The reason Boko Haram still exists, they raise no eye brow on rape, domestic violence but would kill someone all in the name of blasphemy.",0
1086,"@mssinenomine The partner violence and abuse is super ridiculous when youre a disabled woman

I came of age literally thinking I was cursed. everyone else seemed to be getting married &amp; having kids...I was getting shifted around to various ppl who all fetishized the idea of having me dead",1
4045,"I suffered enough!

#COVIDー19 #domesticviolence #MentalHealthAwareness #Monster",0
3625,"@steveevets26 Was none taken Steve I agree 2000% with you !
I’m passionate about domestic violence I’ve scars all over my body from and abusive father and crazy mother ! 
I thank god for the hubster every day of my life at 13 he told me he would take me away from it and he did 40 yrs may xx❤️",0
488,"@JacquiHeinrich Said governor also has made statements that Trump is “greatest threat to American people”, that he was implicit in kidnap plot, and before rally yesterday that Trump “incites domestic violence”. I don’t think rhetoric on either side is good, but lets not pearl clutch to one side",0
3368,Few days back I sat down to depict the story of a domestic abuse survivor. The videos and the stories shook me to my core. How much women face in this society and this world in terms of abuse Is just heartbreaking and a matter of shame. Its about time we truly address this issue.,0
2468,@mechanteauthor @SonMemphis of domestic abuse.  those numbers are staggering. and its amazing that my initial point still stands. you dont wanna end toxic misandry because it benefits you. i hope it doesnt get you caught up,0
126,"@karooyouth Those figures are striking. Interpretation is broad here: long bike rides, drives, picnics all being justified 😫 I’d welcome stricter rules (despite 2 kids, tiny flat, no garden) to save lives &amp; get this over with. Limiting alcohol might also reduce soaring domestic violence?",0
1120,"i don't ship thresh with senna at all and i really don't understand why some ppl do 😅💦 he's more like her abusive dad or toxic ex than a love interest lol―

besides she already has a husband y'all... a freaking H U S B A N D",0
1807,"@AdultCuddleshy @northwoodsmom22 @CordiDad @robbystarbuck @TheRikJones @AOC A life threatening situation is still an abortion. I don’t vilify those who need one for life-threatening situations, rape, incest, domestic violence, financial decision or any decision.",0
4297,"@reader_jean @StormyangelDi @lbush0409 @RonLPitts @SteveSchmidtSES @MSNBC @ProjectLincoln Ok, I was sympathetic - I've been abused &amp; work with domestic abuse victims. Then, the Melania tapes. This needs to end - then, if there is a prob between them they can address it.",0
3144,In regards to that chris brown tweet I went way too far. It wasn’t funny and I shouldn’t have said it. Domestic Violence is not something I condone not even a little bit.,0
3630,"@watcherworthit my partner literally said to me “i feel like if anyone did that to you it would be ....not good and very violent” 
like i need to see someone get mad 
where is the damn accountability",0
1697,"@AdelekeAlao @velveteenlawyer I don’t think the contract would have envisage domestic violence specifically. But there must have been a general statement, take for example ‘misconduct’ that’ll cover unanticipated actions that may lead to termination of contract.",0
435,@emzilbaker Of course you’re going to blame it on men lol. I don’t think you know too much about men or what we are about to make any statements about us. Focus on the high domestic violence and divorce rate among your people. 🏳️‍🌈🏳️‍🌈,0
2691,"The RWFWs v BLM: There’s no racism in Australia or the US. Oh well ok there could be but it’s not systemic.  Oh well it might be systemic sometimes, but look at domestic violence in indigenous/black communities - much bigger problem. I kid you not. 🤦‍♂️ #BlackLivesMatter",0
245,"@joaniebutler_ @chelseateacup @taylorswift13 @zanelowe @AppleMusic If she’s made it before, I haven’t seen it so I’d be open to being shown any proof of it. It’s always best to be safe than sorry. So many people are afraid to talk about domestic violence. If she’s okay, that’s wonderful, but on the off chance she’s not it’s okay to make sure.",0
3276,"Michelle is my friend. She is a #DomesticViolence survivor, trying to get back on her feet. She is staying with her Sister’s while awaiting a decision on disability for #Lupus #Sjogrens dealing with her #mentalhealth on top of it. Please donate or RT- whatever you can do 🙏🏼 twitter.com/auntieshay0304…",0
2212,@veelondon_ That’s true Mais one of the things she said was factual tho. Especially the domestic violence the Congolese community are actually okay with husbands beating their wives etc... it’s my parents love that still  sometimes changes my point of view on Congolese marriages,0
2595,#Panorama #domesticviolence This is why I fundraise for the women’s refuges. Please retweet and donate if you can  gofundme.com/f/hampshire-wo… via @gofundme,0
3471,"@McglynnDunn @KaiseratCB I guess since she's #RachaelGreen,she thinks like making a below the belt remark with the sensitivity chip missing  will be admired for. Aniston doesn't care the pain of what we have lost during this epidemic, elderly been neglected,left alone,women &amp; kids faced domestic violence",0
2495,@jeffbrutlag This is domestic abuse and I don’t condone it.,0
512,@dougducey @AZGOYFF @ndvh I CAN SEE ONLY 1 DOMESTIC VIOLENCE IT IS YOUR'R AGENDA TO CREATE LOW TO WEARING MASKS,0
3929,@Elisabe74545740 @HumanHeadline Thank you for sharing this. I'm glad your husband has found someone who understands the abuse he has experienced and he is in a relationship now with someone who loves him for him. I am happy again &amp; despite the mess I have grown strong &amp; have an epic partner who loves me for me.,0
1331,"@Roblev0 @Rudy48053087 @susan04071 @chrisgregson123 @DavidGSmith18 @Davidmetroland @BeowulfSchaefer @european_kate @ShaneJa16905901 @David19531501 @Jag11814459 @AndyCarp18 @Macid3000 @Alex_B1971 @BeakyDruggan @butlerrichard2 @afewpoints @VeuveK @BigBayBear @David_Vaporium @dw2essex @akhenaten2020 @CheeseNBranston @kid_alabama @mindedmusically @Matt_GS @AwayFromTheKeys @f505eb72b9cd493 @cathyby @Begentle50 @Gazza41 @Charlie_45uk @Sir_Tom_Tucker @markwh2001 @brianbloop2 @Swen28002 @davidjamesrobe4 @Ronald_1959 @richdunleave @Swen_2017 @6d7f272b973849c @resiguru @BrianWi62063896 @ProUdin2016 @The_Leaver @GeoffKeey @GeoffBarton9 @Centrefuter @TeeteringAngel @rosebudorson If it said injury or harm,
I might well agree with that interpretation myself

However the explicit inclusion of illness, in addition to harm and injury, leads me to interpret it as covering beyond collapsed buildings and domestic abuse, which would not require mention of illness",0
2995,"@elizaskinner October is Domestic Violence Awareness month and I recommend anyone under this thread read No Visible Bruises. It helped me cope with my own experience w intimate partner violence, and the rates are spiking bc of COVID",1
2478,@lamelaza_7 @Joelsherman1 Sir.. with your history of domestic violence... as a baseball fan I say..... good riddance.,0
726,"@_Rian_Stone 35. I work to end rape, domestic violence and the patriarchy. How happy is your partner.",0
4181,"@dysthymikey Yup…i’ve heard some of those things as well. That being said, I feel okay with having him on my team. If we are talking other bad things, like domestic violence, that is another story.",0
3130,Domestic violence calls are getting higher during this time. I’ve seen so many police taking children from homes the past 3 days it’s sad,0
238,"There are many organizations that handle cases like this.
Off the top of my head, FIDA is one that handle cases of domestic violence especially against women &amp; children...from my observation, they do a good job &amp; don't take cases just for clout.
@FIDANigeria twitter.com/MayoksMichael/…",0
595,"@nixw20 Just yesterday I was thinking the same thing. This has to be the worst domestic violence case(s) in history. I feel beat up, demeaned, abused and mentally drained. I’m taking the pets and moving to Joe’s in November.",0
913,"@OlgaNYC1211 Yes. I’m having the same reaction. As if we are escaping an abusive relationship and now finding ourselves in the arms of decency, honor, compassion and competence",0
812,"Glad to hear the #DomesticViolence topic be raised.

Imagine being locked up with your abuser! 

One of the first things I thought of, though I havent experienced it myself.

Wish I could offer my sofa bed as an isolation option for someone.",0
3014,"@catrollison @Matthew34829795 I appreciate the apology but it's unnecessary, I just want everyone to focus their energy in the right place and that is government inaction in dealing with domestic violence head on,  as well as the fact they stripped cash from much needed support services.",0
2745,"@kodeetyler I’m a victim of domestic violence. It doesn’t trigger me. I just scroll and ignore. It’s not something I like, but I can only control my reactions. Not others.",0
2297,"@RobbieRinder I am personally suffering a massive injustice due to domestic violence and the lack of action by the police, it is soul destroying that after fighting for 18 months after leaving my ex that he has still not been charged with the horrific things he did to me..I have lost my spirit",1
